<!ELEMENT pokemons (pokemon+)>
<!ELEMENT pokemon (nombre, tipo, nivel, ataques)>
<!ELEMENT nombre (#PCDATA)>
<!ELEMENT tipo (#PCDATA)>
<!ELEMENT nivel (#PCDATA)>
<!ELEMENT ataques (ataque+)>
<!ELEMENT ataque (nombreAtaque, poder)>
<!ELEMENT nombreAtaque (#PCDATA)>
<!ELEMENT poder (#PCDATA)>